{
  "source_id": "sectoral-regulator-placeholder",
  "source_name": "Sectoral Regulatory Source (Placeholder — Pending Official Verification)",
  "source_type": "sectoral_regulator",
  "authority_level": "unknown",
  "reliability_level": "unknown",
  "jurisdiction_scope": "national",
  "country_code": "AR",
  "topic_scope": ["sectoral_requirements", "import_permits"],
  "language": "es",
  "source_locator": "sample://sectoral/regulator-placeholder",
  "verification_status": "unverified_sample",
  "expected_update_cadence": { "label": "irregular" },
  "freshness_status": "requires_review",
  "human_review_required": true,
  "downstream_allowed": false,
  "notes": [
    "Intentional placeholder: no official sectoral regulatory source has been verified in the repository yet.",
    "Remains unverified and requires_review until an official sectoral source is clearly identified and verified."
  ],
  "limitations": [
    "Locator is a non-authoritative placeholder; no official sectoral source has been verified.",
    "Authority and reliability are unknown and must not be assumed.",
    "Irregular cadence means freshness cannot be inferred from elapsed time alone."
  ],
  "metadata": {
    "contract_version": "1.0.0",
    "onboarding": "verified-official-source-onboarding",
    "placeholder": true
  },
  "created_at": "2026-06-06T00:00:00.000Z",
  "updated_at": "2026-06-06T00:00:00.000Z",
  "schema_version": "1.0.0"
}
