{
  "source_id": "ar-ncm-customs",
  "source_name": "Argentina NCM / Customs Reference (Sample / Non-Authoritative)",
  "source_type": "ncm_reference",
  "authority_level": "official",
  "reliability_level": "high",
  "jurisdiction_scope": "national",
  "country_code": "AR",
  "topic_scope": ["ncm_tariff", "customs_notices"],
  "language": "es",
  "source_locator": "sample://ar/ncm-customs",
  "verification_status": "unverified_sample",
  "expected_update_cadence": { "label": "monthly" },
  "last_checked_at": "2026-06-01T00:00:00.000Z",
  "freshness_status": "unknown",
  "human_review_required": true,
  "downstream_allowed": false,
  "notes": [
    "Sample registry entry for schema validation only.",
    "Replace source_locator with a verified official Argentine customs source before any downstream use."
  ],
  "limitations": [
    "Locator is a non-authoritative placeholder; no official source has been verified."
  ],
  "created_at": "2026-06-06T00:00:00.000Z",
  "updated_at": "2026-06-06T00:00:00.000Z",
  "schema_version": "1.0.0"
}
