{
  "source_id": "ar-decreto-557-2023",
  "source_name": "Argentina Decreto 557/2023 — NCM adjusted to the VII Amendment of the Harmonized System (AEC and export refunds)",
  "source_type": "ncm_reference",
  "authority_level": "official",
  "reliability_level": "high",
  "jurisdiction_scope": "national",
  "country_code": "AR",
  "topic_scope": [
    "ncm_tariff",
    "common_external_tariff",
    "export_refunds",
    "hs_amendment_vii"
  ],
  "language": "es",
  "source_locator": "https://www.boletinoficial.gob.ar/",
  "official_url": "https://www.boletinoficial.gob.ar/",
  "verification_status": "verified_official",
  "expected_update_cadence": { "label": "irregular" },
  "freshness_status": "requires_review",
  "human_review_required": true,
  "downstream_allowed": false,
  "notes": [
    "Official Argentine normative reference (Boletín Oficial / InfoLeg) for Decreto 557/2023, recorded as a verified source identity.",
    "Modifying decrees and resolutions are expected over time and must be discovered and reviewed before any downstream use."
  ],
  "limitations": [
    "The legal text has not been ingested; this entry records the official source reference only.",
    "No claim is made about the current in-force status, scope, or applicability of Decreto 557/2023 or its amendments.",
    "A version-pinned official document locator and any modifying norms still require human verification."
  ],
  "metadata": {
    "contract_version": "1.0.0",
    "onboarding": "verified-official-source-onboarding",
    "issuing_authority": "República Argentina (Poder Ejecutivo Nacional)",
    "secondary_official_portals": ["https://www.infoleg.gob.ar/"]
  },
  "created_at": "2026-06-06T00:00:00.000Z",
  "updated_at": "2026-06-06T00:00:00.000Z",
  "schema_version": "1.0.0"
}
