{
  "source_id": "mercosur-common-nomenclature",
  "source_name": "MERCOSUR Common Nomenclature / Norms (Sample / Non-Authoritative)",
  "source_type": "mercosur_norm",
  "authority_level": "semi_official",
  "reliability_level": "medium",
  "jurisdiction_scope": "regional",
  "regional_scope": "MERCOSUR",
  "topic_scope": ["regional_nomenclature", "common_external_tariff"],
  "language": "es",
  "source_locator": "sample://mercosur/common-nomenclature",
  "verification_status": "unverified_sample",
  "expected_update_cadence": { "label": "quarterly" },
  "freshness_status": "unknown",
  "human_review_required": true,
  "downstream_allowed": false,
  "notes": [
    "Sample registry entry for schema validation only.",
    "Replace source_locator with a verified official MERCOSUR source before any downstream use."
  ],
  "limitations": [
    "Locator is a non-authoritative placeholder; no official source has been verified."
  ],
  "created_at": "2026-06-06T00:00:00.000Z",
  "updated_at": "2026-06-06T00:00:00.000Z",
  "schema_version": "1.0.0"
}
